{
  "$id": "EDJzXg34opr6-odFix6lpiccfHF7ksITHuIES_MQRH4b",
  "$schema": "https://json-schema.org/draft/2020-12/schema",
  "title": "SEDI Guardianship Schema",
  "description": "SEDI Guardianship JSON Schema for acm ACDC.",
  "credentialType": "SEDI_Guardian_ACDC_acm_message",
  "version": "0.1.0",
  "type": "object",
  "required": [
    "v",
    "d",
    "i",
    "rd",
    "s",
    "a",
    "e",
    "r"
  ],
  "properties": {
    "v": {
      "description": "ACDC version string",
      "type": "string"
    },
    "t": {
      "description": "Message type",
      "type": "string"
    },
    "d": {
      "description": "Message SAID",
      "type": "string"
    },
    "u": {
      "description": "Message UE",
      "type": "string"
    },
    "i": {
      "description": "Issuer AID",
      "type": "string"
    },
    "rd": {
      "description": "Registry SAID",
      "type": "string"
    },
    "s": {
      "description": "Schema Section",
      "oneOf": [
        {
          "description": "Schema Section SAID",
          "type": "string"
        },
        {
          "description": "Schema Section Detail",
          "type": "object"
        }
      ]
    },
    "a": {
      "description": "Attribute Section",
      "oneOf": [
        {
          "description": "Attribute Section SAID",
          "type": "string"
        },
        {
          "description": "Attribute Section Detail",
          "type": "object",
          "required": [
            "d",
            "u",
            "i",
            "role",
            "ward",
            "issuedDate"
          ],
          "properties": {
            "d": {
              "description": "Attribute Section SAID",
              "type": "string"
            },
            "u": {
              "description": "Attribute Section UE",
              "type": "string"
            },
            "i": {
              "description": "Issuee AID",
              "type": "string"
            },
            "rd": {
              "description": "Issuee Presentation Registry SAID",
              "type": "string"
            },
            "role": {
              "description": "Guardian Role",
              "type": "string"
            },
            "ward": {
              "description": "Ward AID",
              "type": "string"
            },
            "issuedDate": {
              "description": "Issued Date Block",
              "oneOf": [
                {
                  "description": "Issued Date SAID",
                  "type": "string"
                },
                {
                  "description": "Issued Date Detail",
                  "type": "object",
                  "required": [
                    "d",
                    "u",
                    "value"
                  ],
                  "properties": {
                    "d": {
                      "description": "Block SAID",
                      "type": "string"
                    },
                    "u": {
                      "description": "Bock UE",
                      "type": "string"
                    },
                    "value": {
                      "description": "Issued Date Value as RFC-3339/ISO-8601 time MBZ",
                      "type": "string"
                    }
                  },
                  "additionalProperties": false
                }
              ]
            },
            "expirationDate": {
              "description": "Expiration Date Block",
              "oneOf": [
                {
                  "description": "Expiration Date SAID",
                  "type": "string"
                },
                {
                  "description": "Expiration Date Detail",
                  "type": "object",
                  "required": [
                    "d",
                    "u",
                    "value"
                  ],
                  "properties": {
                    "d": {
                      "description": "Block SAID",
                      "type": "string"
                    },
                    "u": {
                      "description": "Bock UE",
                      "type": "string"
                    },
                    "value": {
                      "description": "Expiration Date Value as RFC-3339/ISO-8601 time MBZ",
                      "type": "string"
                    }
                  },
                  "additionalProperties": false
                }
              ]
            }
          },
          "additionalProperties": false
        }
      ]
    },
    "e": {
      "description": "Edge Section",
      "oneOf": [
        {
          "description": "Edge Section SAID",
          "type": "string"
        },
        {
          "description": "Edge Section Detail",
          "type": "object",
          "required": [
            "d",
            "u",
            "utahAgent"
          ],
          "properties": {
            "d": {
              "description": "Edge Section SAID",
              "type": "string"
            },
            "u": {
              "description": "Edge Section UE",
              "type": "string"
            },
            "utahAgent": {
              "description": "Utah Agent Edge Block",
              "type": "object",
              "required": [
                "n",
                "s",
                "o"
              ],
              "properties": {
                "d": {
                  "description": "Edge SAID",
                  "type": "string"
                },
                "u": {
                  "description": "Edge UE",
                  "type": "string"
                },
                "n": {
                  "description": "Far Node SAID",
                  "type": "string"
                },
                "s": {
                  "description": "Far Node Schema SAID",
                  "type": "string"
                },
                "o": {
                  "description": "Edge Unary Operator",
                  "type": "string"
                }
              },
              "additionalProperties": false
            }
          },
          "additionalProperties": false
        }
      ]
    },
    "r": {
      "description": "Rule Section",
      "oneOf": [
        {
          "description": "Rule Section SAID",
          "type": "string"
        },
        {
          "description": "Rule Section Detail",
          "type": "object",
          "required": [
            "d",
            "l"
          ],
          "properties": {
            "d": {
              "description": "Rule Section SAID",
              "type": "string"
            },
            "l": {
              "description": "Legal Language",
              "type": "string"
            }
          },
          "additionalProperties": false
        }
      ]
    }
  },
  "additionalProperties": false
}
